{
  "schema_version": "1.1",
  "name": "churncast",
  "model_version": "1.1.0",
  "kind": "logistic_regression",
  "target": "churned_next_month",
  "experiment": "E2",
  "features": [
    "tenure_months",
    "is_new",
    "plan_standard",
    "plan_premium",
    "discount_share",
    "price_change_pct",
    "meals_last_month",
    "skip_rate_last_month",
    "meals_trend",
    "late_rate_3m",
    "avg_rating_3m",
    "rating_missing",
    "tickets_90d",
    "open_tickets",
    "failed_payments_3m"
  ],
  "intercept": 1.869039107261008,
  "coefficients": {
    "tenure_months": -0.02080099390276665,
    "is_new": 0.6956624051752173,
    "plan_standard": -0.024858024029400766,
    "plan_premium": 0.028461302312966955,
    "discount_share": 2.8390888922587254,
    "price_change_pct": 3.069728698519728,
    "meals_last_month": 0.002047248500109858,
    "skip_rate_last_month": 3.9710473805800457,
    "meals_trend": -0.010355762212250362,
    "late_rate_3m": 0.1526589031308425,
    "avg_rating_3m": -1.1232390658327704,
    "rating_missing": -0.27795798744463607,
    "tickets_90d": 0.257517987852533,
    "open_tickets": -0.11403553890434505,
    "failed_payments_3m": 0.2978854892069755
  },
  "feature_means": {
    "tenure_months": 4.410464432686655,
    "is_new": 0.39782480893592004,
    "plan_standard": 0.38659611992945325,
    "plan_premium": 0.1628453850676073,
    "discount_share": 0.02944542025924484,
    "price_change_pct": 0.0012440127488159197,
    "meals_last_month": 21.18442092886537,
    "skip_rate_last_month": 0.1154086163091866,
    "meals_trend": 1.8395061728395061,
    "late_rate_3m": 0.07360443590195287,
    "avg_rating_3m": 4.177256042631906,
    "rating_missing": 0.25520282186948856,
    "tickets_90d": 0.42104644326866547,
    "open_tickets": 0.05984714873603762,
    "failed_payments_3m": 0.07495590828924162
  },
  "high_risk_threshold": 0.2798363169614716,
  "base_rate": 0.14009315657470442,
  "training": {
    "export": "2026-07",
    "contract_version": "1.1.0",
    "snapshots": [
      "2025-09",
      "2025-10",
      "2025-11",
      "2025-12",
      "2026-01",
      "2026-02",
      "2026-03",
      "2026-04"
    ],
    "rows": 17010,
    "churners": 1606
  },
  "test_metrics": {
    "auc": 0.7732749584469176,
    "average_precision": 0.4919772880836555,
    "brier": 0.11290895892091794,
    "ece": 0.013176847130634236,
    "precision_at_top": 0.5798611111111112,
    "recall_at_top": 0.348643006263048
  },
  "monitoring_reference": {
    "bins": 10,
    "rows": 17010,
    "features": {
      "tenure_months": {
        "edges": [
          0.0,
          1.0,
          2.0,
          3.0,
          4.0,
          5.0,
          6.0,
          8.0,
          10.0
        ],
        "shares": [
          0.16019988242210464,
          0.13074661963550852,
          0.10687830687830688,
          0.0912992357436802,
          0.08283362727807173,
          0.07630805408583187,
          0.06872427983539095,
          0.1186360964138742,
          0.0831275720164609,
          0.08124632569077013
        ]
      },
      "is_new": {
        "edges": [
          0.0,
          1.0
        ],
        "shares": [
          0.6021751910640799,
          0.39782480893592004,
          0.0
        ]
      },
      "plan_standard": {
        "edges": [
          0.0,
          1.0
        ],
        "shares": [
          0.6134038800705467,
          0.38659611992945325,
          0.0
        ]
      },
      "plan_premium": {
        "edges": [
          0.0,
          1.0
        ],
        "shares": [
          0.8371546149323927,
          0.1628453850676073,
          0.0
        ]
      },
      "discount_share": {
        "edges": [
          0.0,
          0.20006062443164596
        ],
        "shares": [
          0.834920634920635,
          0.10770135214579658,
          0.05737801293356849
        ]
      },
      "price_change_pct": {
        "edges": [
          0.0
        ],
        "shares": [
          0.9882422104644327,
          0.011757789535567314
        ]
      },
      "meals_last_month": {
        "edges": [
          12.0,
          16.0,
          18.0,
          20.0,
          22.0,
          23.0,
          25.0,
          27.0,
          30.0
        ],
        "shares": [
          0.10734861845972957,
          0.11258083480305703,
          0.09847148736037625,
          0.11775426219870665,
          0.12087007642563198,
          0.059200470311581425,
          0.11804820693709582,
          0.08830099941211052,
          0.08982951205173427,
          0.08759553203997648
        ]
      },
      "skip_rate_last_month": {
        "edges": [
          0.0,
          0.03571428571428571,
          0.05,
          0.07142857142857142,
          0.08823529411764706,
          0.1111111111111111,
          0.13793103448275862,
          0.18181818181818182,
          0.25
        ],
        "shares": [
          0.14250440917107585,
          0.05984714873603762,
          0.10094062316284538,
          0.10417401528512639,
          0.09300411522633745,
          0.11293356848912404,
          0.08665490887713109,
          0.10746619635508524,
          0.10258671369782481,
          0.08988830099941211
        ]
      },
      "meals_trend": {
        "edges": [
          -3.5,
          -2.0,
          -0.5,
          0.0,
          1.0,
          2.5,
          5.0,
          9.0
        ],
        "shares": [
          0.1225161669606114,
          0.08806584362139917,
          0.11275720164609053,
          0.20064667842445622,
          0.07883597883597884,
          0.0980599647266314,
          0.11734273956496179,
          0.08412698412698413,
          0.09764844209288653
        ]
      },
      "late_rate_3m": {
        "edges": [
          0.01694915254237288,
          0.037037037037037035,
          0.04878048780487805,
          0.058823529411764705,
          0.06779661016949153,
          0.07692307692307693,
          0.08823529411764706,
          0.10204081632653061,
          0.125
        ],
        "shares": [
          0.1001763668430335,
          0.10252792475014698,
          0.0977660199882422,
          0.10358612580834803,
          0.09900058788947678,
          0.09994121105232216,
          0.09841269841269841,
          0.1,
          0.10764256319811875,
          0.09094650205761316
        ]
      },
      "avg_rating_3m": {
        "edges": [
          3.875,
          4.0,
          4.083333333333333,
          4.2105263157894735,
          4.333333333333333,
          4.454545454545454,
          4.608695652173913
        ],
        "shares": [
          0.10035273368606702,
          0.37354497354497357,
          0.02915931804820694,
          0.09841269841269841,
          0.11657848324514991,
          0.08336272780717226,
          0.0988830099941211,
          0.09970605526161082
        ]
      },
      "rating_missing": {
        "edges": [
          0.0,
          1.0
        ],
        "shares": [
          0.7447971781305115,
          0.25520282186948856,
          0.0
        ]
      },
      "tickets_90d": {
        "edges": [
          0.0,
          1.0
        ],
        "shares": [
          0.6703115814226925,
          0.2551440329218107,
          0.07454438565549677
        ]
      },
      "open_tickets": {
        "edges": [
          0.0
        ],
        "shares": [
          0.9428571428571428,
          0.05714285714285714
        ]
      },
      "failed_payments_3m": {
        "edges": [
          0.0
        ],
        "shares": [
          0.9272192827748383,
          0.07278071722516168
        ]
      }
    },
    "score": {
      "edges": [
        0.04749077590228883,
        0.05986922612781382,
        0.07266437424416479,
        0.08736063991648191,
        0.106136263694473,
        0.1296387109005354,
        0.16125422297478678,
        0.2088236368225707,
        0.2944764458851645
      ],
      "shares": [
        0.1,
        0.1,
        0.1,
        0.1,
        0.1,
        0.1,
        0.1,
        0.1,
        0.1,
        0.1
      ]
    }
  },
  "lineage": {
    "parent_model_version": "1.0.0",
    "refit_snapshots": [
      "2025-09",
      "2025-10",
      "2025-11",
      "2025-12",
      "2026-01",
      "2026-02",
      "2026-03",
      "2026-04"
    ],
    "calibration_snapshot": "2026-05",
    "calibration_offset": 0.5639291105424934,
    "decided_on": "2026-06",
    "decision": "promote"
  },
  "generator": {
    "track": "python",
    "version": "1.1.0"
  }
}
